<?xml version="1.0"?>
<xs:schema version="1.0"
           xmlns:xs="http://www.w3.org/2001/XMLSchema"
           xmlns:d="http://naep.divi.de/daten"
           xmlns:std="http://naep.divi.de/strukturen/std"
           xmlns:red="http://naep.divi.de/meta/redaktionell"
           targetNamespace="http://naep.divi.de/daten"
           elementFormDefault="qualified">

    <xs:import namespace="http://www.w3.org/XML/1998/namespace"
               schemaLocation="http://www.w3.org/2001/03/xml.xsd"/>
    <xs:import namespace="http://naep.divi.de/strukturen/std"
               schemaLocation="naep-strukturen-std.xsd"/>
    
    <xs:element name="naep">
        <xs:complexType>
            <xs:sequence>
                <xs:element name="version" minOccurs="1" maxOccurs="1">
                    <xs:complexType>
                        <xs:attribute name="protokoll" type="xs:token" use="required"/>
                        <xs:attribute name="metamodell" type="xs:token" use="required"/>
                    </xs:complexType>
                </xs:element>
                <xs:element name="abschnitte" minOccurs="1" maxOccurs="1">
                    <xs:complexType>
                        <xs:sequence>
                            <xs:element ref="d:abs" minOccurs="1" maxOccurs="unbounded"/>
                        </xs:sequence>
                    </xs:complexType>
                </xs:element>
            </xs:sequence>
            <xs:attribute name="schemaVersion" type="xs:token" use="required" fixed="1.0"/>
        </xs:complexType>
    </xs:element>
    
    <xs:element name="abs" type="d:TypAbschnitt"/>
    
    <xs:complexType name="TypAbschnitt">
        <xs:sequence>
            <xs:choice minOccurs="1" maxOccurs="1">
                <xs:element name="nb"/>
                <xs:sequence>
                    <xs:group ref="d:GrAbschnitt" minOccurs="1" maxOccurs="1"/>
                    <xs:element ref="d:abs" minOccurs="0" maxOccurs="unbounded"/>
                </xs:sequence>
                <xs:element ref="d:abs" minOccurs="1" maxOccurs="unbounded"/>
            </xs:choice>
        </xs:sequence>
        <xs:attributeGroup ref="d:AGrCodeAsId"/>
    </xs:complexType>
    
    <xs:group name="GrAbschnitt">
        <xs:choice>
            <xs:element name="dat" type="d:TypDaten"/>
            <xs:element name="ver" type="d:TypVerlauf"/>
            <xs:element name="leer">
                <xs:complexType>
                    <xs:attributeGroup ref="d:AGrCodeAsId"/>
                </xs:complexType>
            </xs:element>
        </xs:choice>
    </xs:group>
    
    <xs:complexType name="TypDaten">
        <xs:sequence>
            <xs:choice minOccurs="1" maxOccurs="1">
                <xs:sequence>
                    <xs:group ref="d:GrEingabe" minOccurs="1" maxOccurs="unbounded"/>
                    <xs:element name="sonst" type="d:TypSonstiges" minOccurs="0" maxOccurs="1"/>
                </xs:sequence>
                <xs:element name="sonst" type="d:TypSonstiges" minOccurs="1" maxOccurs="1"/>
            </xs:choice>
        </xs:sequence>
    </xs:complexType>
    
    <xs:complexType name="TypLeer">
        <xs:attribute name="a" type="d:TypCode" use="optional"/>
        <xs:attribute name="g" type="d:TypCode" use="optional"/>
        <xs:attributeGroup ref="d:AGrCode"/>
    </xs:complexType>
    
    <xs:complexType name="TypVerlauf">
        <xs:sequence>
            <xs:choice minOccurs="1" maxOccurs="1">
                <xs:element name="leer">
                    <xs:complexType>
                        <xs:attributeGroup ref="d:AGrCode"/>
                    </xs:complexType>
                </xs:element>
                <xs:sequence>
                    <xs:element name="r" minOccurs="1" maxOccurs="unbounded">
                        <xs:complexType>
                            <xs:sequence>
                                <xs:group ref="d:GrEingabe" minOccurs="0" maxOccurs="unbounded"/>
                            </xs:sequence>
                        </xs:complexType>
                    </xs:element>
                </xs:sequence>
            </xs:choice>
        </xs:sequence>
        <xs:attributeGroup ref="d:AGrCodeAsId"/>
    </xs:complexType>
    
    <xs:complexType name="TypFrage">
        <xs:attribute name="f" type="d:TypCode" use="required"/>
        <xs:attribute name="w" type="std:TypAntwort" use="required"/>
    </xs:complexType>
    
    <xs:group name="GrEingabe">
        <xs:choice>
            <xs:element name="wrt" type="d:TypFeld"/>
            <xs:element name="sel" type="d:TypAuswahl">
                <xs:unique name="selektiert">
                    <xs:selector xpath="d:selektiert"/>
                    <xs:field xpath="@code"/>
                </xs:unique>
            </xs:element>
            <xs:element name="leer" type="d:TypLeer"/>
            <xs:element name="sonst" type="d:TypSonstiges"/>
            <xs:element name="ant" type="d:TypFrage"/>
            <xs:element name="txt">
                <xs:complexType>
                    <xs:sequence>
                        <xs:element name="z" minOccurs="1" maxOccurs="unbounded"/>
                    </xs:sequence>
                    <xs:attributeGroup ref="d:AGrCode"/>
                </xs:complexType>
            </xs:element>
            <xs:element name="str" type="d:TypStrukturiert"/>
        </xs:choice>
    </xs:group>
    
    <xs:complexType name="TypAuswahl">
        <xs:attribute name="a" type="d:TypCode" use="required"/>
        <xs:attribute name="o" type="d:TypCode" use="required"/>
        <xs:attribute name="n" type="xs:decimal" use="optional"/>
    </xs:complexType>
    
    <xs:complexType name="TypStrukturiert">
        <xs:sequence>
            <xs:element name="e" type="std:TypStrukturiertBase" minOccurs="1" maxOccurs="1"/>
            <xs:group ref="d:GrEingabe" minOccurs="0" maxOccurs="unbounded"/>
        </xs:sequence>
        <xs:attributeGroup ref="d:AGrCode"/>
    </xs:complexType>
    
    <xs:complexType name="TypSonstiges">
        <xs:attributeGroup ref="d:AGrCode"/>
        <xs:attribute name="t" type="std:TypText" use="required"/>
        <xs:attribute name="a" type="d:TypCode" use="optional"/>
    </xs:complexType>
    
    <xs:complexType name="TypFeld">
        <xs:attribute name="f" type="d:TypCode" use="required"/>
        <xs:attribute name="d" type="d:TypDatum" use="optional"/>
        <xs:attribute name="z" type="std:TypZeit" use="optional"/>
        <xs:attribute name="t" type="std:TypText" use="optional"/>
        <xs:attribute name="n" type="xs:decimal" use="optional"/>
        <xs:attribute name="e" type="std:TypText" use="optional"/>
    </xs:complexType>
    
    <xs:simpleType name="TypEinheit">
        <xs:list itemType="xs:string">
        </xs:list>
    </xs:simpleType>
    
    <xs:simpleType name="TypDatum">
        <xs:restriction base="xs:date">
            <xs:pattern value="([0-9]{4})-([0-9]{2})-([0-9]{2})"/>
        </xs:restriction>
    </xs:simpleType>
    
    <xs:simpleType name="TypId">
        <xs:restriction base="xs:ID">
            <xs:minLength value="3"/>
            <xs:maxLength value="6"/>
        </xs:restriction>
    </xs:simpleType>
    
    <xs:simpleType name="TypCode">
        <xs:restriction base="xs:token">
            <xs:minLength value="3"/>
            <xs:maxLength value="6"/>
        </xs:restriction>
    </xs:simpleType>
    
    <xs:attributeGroup name="AGrCode">
        <xs:attribute name="c" type="d:TypCode" use="required"/>
    </xs:attributeGroup>
    
    <xs:attributeGroup name="AGrCodeAsId">
        <xs:attribute name="c" type="d:TypId" use="required"/>
    </xs:attributeGroup>
    
    <xs:attributeGroup name="AGrCodeTerm">
        <xs:attributeGroup ref="d:AGrCode"/>
        <xs:attribute name="term" type="std:TypText" use="required"/>
    </xs:attributeGroup>
    
    <xs:attributeGroup name="AGrCodeOptTerm">
        <xs:attributeGroup ref="d:AGrCode"/>
        <xs:attribute name="term" type="std:TypText"/>
    </xs:attributeGroup>
    
</xs:schema>
