<?xml version="1.0" encoding="UTF-8"?>
<dt:naep xsi:schemaLocation="http://naep.divi.de/daten ../xsd/naep-daten.xsd http://naep.divi.de/strukturen/std ../xsd/naep-strukturen-std.xsd" schemaVersion="1.0" xmlns:std="http://naep.divi.de/strukturen/std" xmlns:dt="http://naep.divi.de/daten" xmlns:xsi="http://www.w3.org/2001/XMLSchema-instance" xmlns:d="http://naep.divi.de/dokument">
    <dt:version protokoll="V.6.0-0.93-NoVar-130820" metamodell="1.0"/>
    <dt:abschnitte>
        <dt:abs c="A01">
            <dt:dat>
                <dt:str c="A08">
                    <dt:e xsi:type="std:PatStammdaten">
                        <std:Patient pseudonym="ja">
                            <std:Name>Mustermann</std:Name>
                            <std:Vorname>Heinz</std:Vorname>
                            <std:GebDat>1970-10-10</std:GebDat>
                        </std:Patient>
                        <std:Adresse>
                            <std:Strasse>Musterstr. 10</std:Strasse>
                            <std:PLZ>11111</std:PLZ>
                            <std:Ort>Musterstadt</std:Ort>
                        </std:Adresse>
                        <std:Versicherung>
                            <std:Kasse nr="123456789">MUSTERKASSE</std:Kasse>
                            <std:VersNr>987654321</std:VersNr>
                        </std:Versicherung>
                    </dt:e>
                    <dt:leer a="A0F" c="A0M"/>
                    <dt:sel a="A17" o="A1E"/>
                    <dt:leer g="A1S" c="A1Z"/>
                </dt:str>
            </dt:dat>
        </dt:abs>
        <dt:abs c="B01">
            <dt:dat>
                <dt:str c="B08">
                    <dt:e xsi:type="std:EinsatztechnischeDaten">
                        <std:EinsatzNr>111111111</std:EinsatzNr>
                        <std:PatNr>222222222</std:PatNr>
                        <std:PersNr>3333333333</std:PersNr>
                        <std:Standort>Musterstandort</std:Standort>
                        <std:LeitstelleKFZ>MU</std:LeitstelleKFZ>
                    </dt:e>
                </dt:str>
                <dt:wrt f="B0F" d="2015-10-20"/>
                <dt:str c="B0M">
                    <dt:e xsi:type="std:Einsatzort">
                    </dt:e>
                    <dt:sel a="B0T" o="B10"/>
                </dt:str>
                <dt:sel a="B3J" o="B3Q"/>
                <dt:wrt f="B6U" t="TEXT TEXT"/>
                <dt:wrt f="B80" t="TEXT TEXT"/>
                <dt:wrt f="BAJ" t="TEXT TEXT"/>
                <dt:wrt f="BBP" t="TEXT TEXT"/>
                <dt:wrt f="BBW" t="TEXT TEXT"/>
                <dt:sel a="BC3" o="BCA"/>
                <dt:wrt f="BEF" z="13:00"/>
                <dt:ant f="BET" w="J"/>
                <dt:wrt f="BF0" z="13:00"/>
                <dt:wrt f="BF7" z="13:00"/>
                <dt:wrt f="BFE" z="13:00"/>
                <dt:wrt f="BFS" z="13:00"/>
                <dt:wrt f="BFZ" z="13:00"/>
                <dt:wrt f="BG6" z="13:00"/>
                <dt:wrt f="BGD" z="13:00"/>
            </dt:dat>
        </dt:abs>
        <dt:abs c="C01">
            <dt:dat>
                <dt:txt c="C08">
                    <dt:z>TEXT TEXT TEXT</dt:z>
                    <dt:z>TEXT TEXT TEXT</dt:z>
                    <dt:z>TEXT TEXT TEXT</dt:z>
                    <dt:z>TEXT TEXT TEXT</dt:z>
                </dt:txt>
                <dt:sel a="C0F" o="C0M"/>
                <dt:leer a="C1L" c="C1S"/>
                <dt:ant f="C2D" w="J"/>
                <dt:wrt f="C2K" z="13:00"/>
                <dt:ant f="C2R" w="J"/>
                <dt:sel a="C2Y" o="C35"/>
            </dt:dat>
        </dt:abs>
        <dt:abs c="D01">
            <dt:abs c="D08">
                <dt:leer c="D0F"/>
            </dt:abs>
            <dt:abs c="DDU">
                <dt:leer c="DE1"/>
            </dt:abs>
            <dt:abs c="DHX">
                <dt:leer c="DI4"/>
            </dt:abs>
            <dt:abs c="DL8">
                <dt:leer c="DLF"/>
            </dt:abs>
            <dt:abs c="DOC">
                <dt:leer c="DOJ"/>
            </dt:abs>
            <dt:abs c="DQH">
                <dt:leer c="DQO"/>
            </dt:abs>
        </dt:abs>
        <dt:abs c="E01">
            <dt:leer c="E08"/>
        </dt:abs>
        <dt:abs c="F01">
            <dt:leer c="F08"/>
        </dt:abs>
        <dt:abs c="G01">
            <dt:dat>
                <dt:txt c="G08">
                    <dt:z>TEXT TEXT TEXT</dt:z>
                    <dt:z>TEXT TEXT TEXT</dt:z>
                    <dt:z>TEXT TEXT TEXT</dt:z>
                    <dt:z>TEXT TEXT TEXT</dt:z>
                </dt:txt>
                <dt:sel a="G0F" o="G0M"/>
                <dt:ant f="G26" w="J"/>
            </dt:dat>
        </dt:abs>
        <dt:abs c="H01">
            <dt:ver c="H08">
                <dt:leer c="H0F"/>
            </dt:ver>
        </dt:abs>
        <dt:abs c="I01">
            <dt:leer c="I08"/>
        </dt:abs>
        <dt:abs c="J01">
            <dt:abs c="J08">
                <dt:dat>
                    <dt:sel a="J0F" o="J0M"/>
                </dt:dat>
            </dt:abs>
            <dt:abs c="J3J">
                <dt:dat>
                    <dt:sel a="J3Q" o="J3X"/>
                </dt:dat>
            </dt:abs>
            <dt:abs c="J8L">
                <dt:dat>
                    <dt:sel a="J8S" o="J8Z"/>
                </dt:dat>
            </dt:abs>
            <dt:abs c="JB4">
                <dt:dat>
                    <dt:sel a="JBB" o="JBI"/>
                </dt:dat>
            </dt:abs>
            <dt:abs c="JE8">
                <dt:dat>
                    <dt:sel a="JEF" o="JEM"/>
                </dt:dat>
            </dt:abs>
            <dt:abs c="JGR">
                <dt:dat>
                    <dt:ant f="JGY" w="J"/>
                    <dt:sel a="JH5" o="JHC"/>
                    <dt:sel a="JJV" o="JK2"/>
                    <dt:sel a="JL8" o="JLF"/>
                    <dt:sel a="JM0" o="JM7"/>
                    <dt:sel a="JN6" o="JND"/>
                    <dt:sonst c="JNR" t="TEXT TEXT TEXT"/>
                </dt:dat>
            </dt:abs>
        </dt:abs>
        <dt:abs c="K01">
            <dt:dat>
                <dt:sel a="K08" o="K0F"/>
                <dt:ant f="K44" w="J"/>
                <dt:ant f="K4B" w="J"/>
                <dt:sel a="K4I" o="K4P"/>
                <dt:wrt f="K5H" z="13:00"/>
            </dt:dat>
        </dt:abs>
        <dt:abs c="L01">
            <dt:abs c="L08">
                <dt:leer c="L0F"/>
            </dt:abs>
            <dt:abs c="L4B">
                <dt:leer c="L4I"/>
            </dt:abs>
            <dt:abs c="L7M">
                <dt:leer c="L7T"/>
            </dt:abs>
            <dt:abs c="LAQ">
                <dt:leer c="LAX"/>
            </dt:abs>
        </dt:abs>
        <dt:abs c="M01">
            <dt:abs c="M08">
                <dt:dat>
                    <dt:sel a="M0F" o="M0M"/>
                    <dt:sel a="M3C" o="M3J"/>
                </dt:dat>
            </dt:abs>
            <dt:abs c="M4W">
                <dt:dat>
                    <dt:leer a="M53" c="M5A"/>
                </dt:dat>
            </dt:abs>
            <dt:abs c="M87">
                <dt:dat>
                    <dt:txt c="M8E">
                        <dt:z>TEXT TEXT TEXT</dt:z>
                        <dt:z>TEXT TEXT TEXT</dt:z>
                        <dt:z>TEXT TEXT TEXT</dt:z>
                        <dt:z>TEXT TEXT TEXT</dt:z>
                    </dt:txt>
                </dt:dat>
            </dt:abs>
        </dt:abs>
    </dt:abschnitte>
</dt:naep>
